{
  "$schema": "../schemas/calibration.schema.json",
  "schemaVersion": "1.0.0",
  "sensor": {
    "id": "nissan-s13-fuel-level-sender",
    "manufacturer": "Nissan",
    "productNumber": "S13 Fuel Level Sender"
  },
  "measurementUnit": "ohm",
  "valueUnit": "percent",
  "calibration": [
    {
      "measurement": 5.3,
      "value": 100
    },
    {
      "measurement": 31,
      "value": 50
    },
    {
      "measurement": 79.05,
      "value": 0
    }
  ]
}
