{
  "$schema": "../schemas/calibration.schema.json",
  "schemaVersion": "1.0.0",
  "sensor": {
    "id": "whp-whp7p",
    "manufacturer": "WHP",
    "productNumber": "WHP7P"
  },
  "measurementUnit": "volt",
  "valueUnit": "bar",
  "calibration": [
    {
      "measurement": 0.5,
      "value": 1.01325
    },
    {
      "measurement": 4.5,
      "value": 8.01325
    }
  ]
}
