{
  "$schema": "../schemas/calibration.schema.json",
  "schemaVersion": "1.0.0",
  "sensor": {
    "id": "ecumaster-generic-oil-temperature-sensor",
    "manufacturer": "ECUMaster",
    "productNumber": "Generic Oil Temperature Sensor",
    "type": "ntc"
  },
  "measurementUnit": "ohm",
  "valueUnit": "celsius",
  "calibration": [
    {
      "measurement": 21.064,
      "value": 174
    },
    {
      "measurement": 53.721,
      "value": 135
    },
    {
      "measurement": 82.5,
      "value": 113
    },
    {
      "measurement": 115.946,
      "value": 98
    },
    {
      "measurement": 170,
      "value": 87
    },
    {
      "measurement": 220,
      "value": 76
    },
    {
      "measurement": 281.111,
      "value": 67
    },
    {
      "measurement": 387.391,
      "value": 59
    },
    {
      "measurement": 495,
      "value": 51
    },
    {
      "measurement": 640.588,
      "value": 43
    },
    {
      "measurement": 939.231,
      "value": 34
    },
    {
      "measurement": 1320,
      "value": 25
    },
    {
      "measurement": 2027.143,
      "value": 13
    },
    {
      "measurement": 5170,
      "value": 0
    }
  ]
}
